{
  "policyId": "problem-evidence-phase1-benchmark-policy",
  "schemaVersion": "1.0.0",
  "reviewStatus": "approved",
  "humanReviewed": true,
  "reviewedBy": "Amina Moufakkir",
  "reviewedDate": "2026-08-06",
  "scope": "Owner-reviewed Phase 1 evaluation policy for recommendation and verification behavior on the three approved synthetic Problem Evidence Auditor benchmark fixtures, revised after the v15 human semantic audit. Comparator enforcement is permitted only while this artifact remains schema-valid and human-approved. This approval is not external compatibility authority, automated reliability, or Phase 1 acceptance.",
  "fixtures": [
    {
      "fixture": "contradictory-evidence.json",
      "requirements": [
        {
          "requirementId": "REQ-1",
          "expectedRecommendationActionType": "preserve-operative-segment-definition-and-add-traceable-rater-metadata",
          "requiredVerificationBehavior": [
            "Use independent application of the written segment definition to real or borderline companies to surface undecidable boundaries.",
            "Treat disagreement in sorting as evidence that the segment definition needs refinement."
          ],
          "prohibitedSubstitutions": [
            "Do not recommend market sizing, product demand testing, or more general interviews as a substitute for definition application.",
            "Do not treat the existing screening sheet as empirical proof of market validity."
          ],
          "notesForReviewer": "The approved finding passes REQ-1 but still asks for traceability and independent sorting."
        },
        {
          "requirementId": "REQ-2",
          "expectedRecommendationActionType": "validate-qualifying-instance-and-optionally-investigate-variation",
          "requiredVerificationBehavior": [
            "Preserve REQ-2 as instance-scoped: one credible qualifying occurrence can establish that the behavior exists.",
            "First validate EV-004's provenance, complete active-assembly measurement boundaries, segment fit, threshold, and supersession status; if it remains credible, it establishes instance-scoped existence.",
            "Treat measurement of further in-segment owners and reuse-versus-blank behavior as optional research into variation or recurrence; any association must not change REQ-2's status, imply causation, or invalidate the segment without separate evidence."
          ],
          "prohibitedSubstitutions": [
            "Do not require recurrence or segment-wide prevalence to pass the instance-scoped REQ-2 question.",
            "Do not treat EV-003 as automatically superseding EV-002 by source identity or chronology.",
            "Do not use out-of-segment EV-015 as support or contradiction."
          ],
          "notesForReviewer": "This rule protects REQ-2 instance scope and OPEN-04."
        },
        {
          "requirementId": "REQ-3",
          "expectedRecommendationActionType": "resolve-period-free-self-report-before-applying-explicit-supersession",
          "requiredVerificationBehavior": [
            "Ask P-11 to identify the period meant by the generalized rate estimate or explicitly correct it.",
            "Apply OPEN-04 only if every explicit supersession condition is satisfied, including same applicable timeframe.",
            "Keep unresolved measured-versus-self-report conflict visible."
          ],
          "prohibitedSubstitutions": [
            "Do not infer supersession from newer instrumented data alone.",
            "Do not discard EV-007 solely because EV-005 is newer or more instrumented.",
            "Do not average rates across conflicting records."
          ],
          "notesForReviewer": "This is the main contradictory fixture OPEN-04 check."
        },
        {
          "requirementId": "REQ-4",
          "expectedRecommendationActionType": "identify-which-subset-experiences-buyer-stated-late-losses",
          "requiredVerificationBehavior": [
            "Collect buyer correspondence over twelve months from additional in-segment owners.",
            "Record whether each loss involved late submission and owner proposal volume.",
            "Use the result to determine whether late-loss consequence tracks with a subset rather than the full segment."
          ],
          "prohibitedSubstitutions": [
            "Do not infer causation from owner loss logs without buyer-stated reasons.",
            "Do not average P-12 late-loss evidence with P-11/P-13 absence into a single numeric score.",
            "Do not convert credible mixed evidence into fail when one owner has buyer-stated late losses."
          ],
          "notesForReviewer": "The expected behavior preserves cross-source conflict rather than erasing either side."
        },
        {
          "requirementId": "REQ-5",
          "expectedRecommendationActionType": "test-existing-problem-commitment-with-optional-volume-context",
          "requiredVerificationBehavior": [
            "Collect expense or staff-allocation records from further independent in-segment owners.",
            "Treat measured proposal volume as optional contextual research, not required REQ-5 verification; if collected, align it to the commitment period and classify it as non-contributing to status.",
            "Use any observed commitment-volume association only to motivate a narrower later hypothesis; do not use it to prove commitment, imply causation, create a segment-wide conclusion, or change the finding without qualifying commitment evidence."
          ],
          "prohibitedSubstitutions": [
            "Do not substitute willingness to pay for the proposed product.",
            "Do not use demand for a proposed product as evidence of existing-problem commitment.",
            "Do not ignore withdrawn or declined commitment records."
          ],
          "notesForReviewer": "This protects REQ-5's existing-problem commitment boundary."
        }
      ]
    },
    {
      "fixture": "missing-evidence.json",
      "requirements": [
        {
          "requirementId": "REQ-1",
          "expectedRecommendationActionType": "rewrite-segment-definition-as-decidable-boundaries",
          "requiredVerificationBehavior": [
            "Define headcount, geography, contract type or service line, and proposal-author role.",
            "Apply the definition to actual companies and record which boundary excludes each one.",
            "Remove the problem itself from the membership definition."
          ],
          "prohibitedSubstitutions": [
            "Do not ask for more evidence against a self-sealing segment definition before rewriting it.",
            "Do not treat adjectives like small or struggling as decidable boundaries."
          ],
          "notesForReviewer": "REQ-1 is gated by a non-falsifiable definition."
        },
        {
          "requirementId": "REQ-2",
          "expectedRecommendationActionType": "rewrite-duration-threshold-then-observe-one-complete-cycle",
          "requiredVerificationBehavior": [
            "Require a duration threshold the team can be wrong about.",
            "Observe or measure one in-segment owner completing the walkthrough-to-proposal cycle with timestamps.",
            "Avoid prompting or assisting during the observation."
          ],
          "prohibitedSubstitutions": [
            "Do not treat vague claims like way too long as testable.",
            "Do not use internal assertions, vendor claims, or unanchored self-report as records of occurrence.",
            "Do not treat missing occurrence evidence as contradiction."
          ],
          "notesForReviewer": "The model should preserve the definition gate and still report unsuitable evidence."
        },
        {
          "requirementId": "REQ-3",
          "expectedRecommendationActionType": "collect-dated-proposal-events-over-continuous-period",
          "requiredVerificationBehavior": [
            "Collect continuous ninety-day calendar, CRM, or proposal-event exports from two independent in-segment owners who pass rewritten screening.",
            "Count dated proposal-sent events in the applicable weekly buckets rather than asking owners for a generalized rate.",
            "Define the applicable evaluation period before counting. For one source, support requires at least two sent proposals in every week of an applicable eight-consecutive-week window; source-level counterevidence requires a complete export covering the claimed period with no qualifying eight-week window. Finding-level fail requires the configured independent-source minimum and no credible same-scope above-threshold support within this packet; period-free estimates remain visible but are neither support nor contradiction."
          ],
          "prohibitedSubstitutions": [
            "Do not ask owners how often it happens as a substitute for dated event records.",
            "Do not use out-of-segment frequency data to support or contradict the stated segment.",
            "Do not treat missing or incomplete records as counterevidence; absence remains missing evidence.",
            "Do not ignore zero or insufficient events in a complete qualifying export, because those can falsify the recurrence claim."
          ],
          "notesForReviewer": "The missing fixture has no usable in-segment frequency evidence."
        },
        {
          "requirementId": "REQ-4",
          "expectedRecommendationActionType": "collect-buyer-stated-loss-reasons-from-bid-history",
          "requiredVerificationBehavior": [
            "Use twelve months of bid-history evidence from two independent in-segment owners who pass rewritten screening.",
            "Request the buyer's written loss reason for each loss.",
            "Buyer-stated lateness or incompleteness supports the consequence; buyer-stated price reasons paired with on-time proposals move the finding toward fail."
          ],